{
  "$schema": "./agent-variant.schema.json",
  "vendor": "codex",
  "destDir": ".codex/agents",
  "modelDefault": "gpt-6.1-terra",
  "effortDefault": "high",
  "toolsDefault": [],
  "protocolPath": ".agents/skills/_shared/runtime/execution-protocols/codex.md",
  "agents": {
    "backend-engineer": {
      "extra": {
        "sandbox_mode": "workspace-write"
      }
    },
    "frontend-engineer": {
      "extra": {
        "sandbox_mode": "workspace-write"
      }
    },
    "db-engineer": {
      "extra": {
        "sandbox_mode": "workspace-write"
      }
    },
    "debug-investigator": {
      "effort": "high",
      "extra": {
        "sandbox_mode": "workspace-write"
      }
    },
    "architecture-reviewer": {
      "effort": "high",
      "extra": {
        "sandbox_mode": "read-only"
      }
    },
    "tf-infra-engineer": {
      "extra": {
        "sandbox_mode": "workspace-write"
      }
    },
    "mobile-engineer": {
      "extra": {
        "sandbox_mode": "workspace-write"
      }
    },
    "pm-planner": {
      "extra": {
        "sandbox_mode": "read-only"
      }
    },
    "qa-reviewer": {
      "effort": "high",
      "extra": {
        "sandbox_mode": "read-only"
      }
    },
    "docs-curator": {
      "model": "gpt-6-luna",
      "effort": "max",
      "extra": {
        "sandbox_mode": "workspace-write"
      }
    },
    "research-explorer": {
      "model": "gpt-6-luna",
      "effort": "max",
      "extra": {
        "sandbox_mode": "read-only"
      }
    }
  }
}
